{
  "$schema": "http://json-schema.org/draft-07/schema#",
  "$id": "https://raw.githubusercontent.com/tekram/protocol-pal-docs/main/schema/protocol.schema.json",
  "title": "Protocol",
  "type": "object",
  "required": ["id", "title", "frequency_type"],
  "additionalProperties": false,
  "properties": {
    "id": { "type": "string" },
    "title": { "type": "string" },
    "description": { "type": "string" },
    "category": { "type": "string" },
    "duration": { "type": "string" },
    "difficulty": { "type": "string", "enum": ["beginner", "intermediate", "advanced"] },
    "priority": { "type": "number" },
    "importance": { "type": "string", "enum": ["foundation", "high-impact", "supplemental"] },
    "frequency_type": { "type": "string", "enum": ["daily", "weekly", "conditional"] },
    "source": { "type": "string" },
    "last_updated": { "type": "string" },
    "oura_triggers": {
      "description": "Legacy flat AND-array (v1) or structured OR-of-AND-groups object (v2, adds evidence_level/state_label/persistence/baseline_pct). Both are read by the app's trigger engine — see src/hooks/useOuraProtocolTriggers.ts.",
      "oneOf": [
        {
          "type": "array",
          "items": { "$ref": "#/definitions/ouraCondition" }
        },
        {
          "type": "object",
          "required": ["groups", "evidence_level"],
          "additionalProperties": false,
          "properties": {
            "groups": {
              "type": "array",
              "minItems": 1,
              "items": {
                "type": "object",
                "required": ["all"],
                "additionalProperties": false,
                "properties": {
                  "all": { "type": "array", "minItems": 1, "items": { "$ref": "#/definitions/ouraCondition" } }
                }
              }
            },
            "evidence_level": { "type": "string", "enum": ["direct_evidence", "evidence_informed", "product_heuristic", "experimental"] },
            "state_label": { "type": "string" },
            "state_family": {
              "type": "string",
              "description": "Groups tiers of the same underlying state (e.g. 'recovery_deficit' for mild/high/severe). When multiple protocols in the same family fire the same day, only the highest severity_rank is kept."
            },
            "severity_rank": {
              "type": "number",
              "description": "Higher wins within the same state_family when more than one fires the same day. Not meaningful without state_family."
            },
            "suppressed_by_family": {
              "type": "array",
              "items": { "type": "string" },
              "description": "This protocol is dropped if any protocol from one of these state_families also fired today."
            }
          }
        }
      ]
    },
    "evidence_metadata": {
      "description": "Optional, non-app-facing documentation of the evidence basis for this protocol's oura_triggers rule. Not read by the app today — carried here so the distinction between 'evidence for the protocol itself' and 'evidence for this specific trigger threshold' isn't lost when a rule is authored. See PLAN-oura-evidence-engine-gap.md in huberman-protocol-pal for the rationale.",
      "type": "object",
      "additionalProperties": false,
      "properties": {
        "target_state": { "type": "string" },
        "scientific_rationale": { "type": "string" },
        "evidence_for_protocol": {
          "type": "object",
          "required": ["level", "notes"],
          "additionalProperties": false,
          "properties": {
            "level": { "type": "string", "enum": ["direct_evidence", "evidence_informed", "product_heuristic", "experimental"] },
            "notes": { "type": "string" }
          }
        },
        "evidence_for_trigger": {
          "type": "object",
          "required": ["level", "notes"],
          "additionalProperties": false,
          "properties": {
            "level": { "type": "string", "enum": ["direct_evidence", "evidence_informed", "product_heuristic", "experimental"] },
            "notes": { "type": "string" }
          }
        },
        "expected_effect": {
          "type": "object",
          "additionalProperties": false,
          "properties": {
            "short_term": { "type": "string" },
            "long_term": { "type": "string" }
          }
        }
      }
    },
    "weekly_frequency": {
      "type": "object",
      "required": ["times_per_week"],
      "additionalProperties": false,
      "properties": {
        "times_per_week": { "type": "number", "minimum": 1, "maximum": 7 },
        "preferred_days": { "type": "array", "items": { "type": "string", "enum": ["monday","tuesday","wednesday","thursday","friday","saturday","sunday"] } },
        "min_rest_days": { "type": "number", "minimum": 0 }
      }
    },
    "conditional": {
      "type": "object",
      "required": ["question"],
      "additionalProperties": false,
      "properties": {
        "question": { "type": "string" },
        "yesLabel": { "type": "string" },
        "noLabel": { "type": "string" }
      }
    },
    "actions": {
      "type": "array",
      "items": {
        "type": "object",
        "required": ["action", "duration", "frequency", "timing", "details"],
        "additionalProperties": false,
        "properties": {
          "action": { "type": "string" },
          "duration": { "type": "string" },
          "frequency": { "type": "string" },
          "timing": { "type": "string" },
          "details": { "type": "string" }
        }
      }
    },
    "benefits": { "type": "array", "items": { "type": "string" } },
    "science": { "type": "string" },
    "contraindications": { "type": "array", "items": { "type": "string" } },
    "estimated_impact": { "type": "object", "additionalProperties": { "type": "string" } },
    "learning_resources": {
      "type": "array",
      "items": {
        "type": "object",
        "required": ["title", "type", "url"],
        "additionalProperties": false,
        "properties": {
          "title": { "type": "string" },
          "type": { "type": "string", "enum": ["video", "webpage", "article"] },
          "url": { "type": "string" },
          "duration": { "type": "string" }
        }
      }
    }
  },
  "definitions": {
    "ouraCondition": {
      "type": "object",
      "required": ["metric", "operator", "threshold"],
      "additionalProperties": false,
      "properties": {
        "metric": {
          "type": "string",
          "enum": [
            "sleep_score", "readiness_score", "hrv", "resting_hr", "activity_score", "temperature_deviation",
            "sleep_latency", "sleep_efficiency", "respiratory_rate", "restless_periods", "sleep_duration",
            "daytime_stress_minutes", "daytime_recovery_minutes", "training_load", "training_load_prev_day"
          ]
        },
        "operator": { "type": "string", "enum": ["<", ">", "<=", ">="] },
        "mode": { "type": "string", "enum": ["absolute", "baseline_pct"] },
        "threshold": { "type": "number" },
        "persistence": { "type": "number", "minimum": 1 },
        "label": { "type": "string" }
      }
    }
  }
}
